{
  "schema_version": "1.0",
  "rail": "run_load",
  "outcome": "success",
  "run_id": "crm-load-wi6",
  "workspace_id": "c3465ab0-210b-4b31-86fd-03d9611fc037",
  "datasets": [
    {
      "name": "accounts",
      "status": "loaded",
      "source_count": null,
      "destination_count": null,
      "supports_source_count": true,
      "reconciliation": "not_applicable",
      "pk_check": "not_applicable"
    }
  ],
  "messages": [
    "CRM load notebook completed; notebook evidence is stored in Fabric."
  ],
  "watermark": null,
  "timestamp": "2026-08-23T14:18:48.386236Z"
}
